[
  {
    "id": "seed_001",
    "user_id": "demo_user",
    "start_time": "2026-06-08T05:30:00+08:00",
    "end_time": "2026-06-08T10:30:00+08:00",
    "duration_seconds": 18000,
    "fishing_spot_name": "东湖听涛景区",
    "location_name": "东湖听涛景区·南岸芦苇丛",
    "latitude": 30.5567,
    "longitude": 114.3691,
    "weather": "晴",
    "temperature": 26,
    "fish_count": 10,
    "fish_weight": 4.5,
    "fish_species": "鲫鱼",
    "fishing_method": "台钓",
    "bait": "酒米+蚯蚓",
    "note": "清晨窗口期连杆，鲫鱼个头不错。东湖水位适中，岸边水草区鱼口密集。调灵漂后明显好转，上午十点后口变稀。",
    "images": [],
    "is_blank_trip": false,
    "blank_reason": null,
    "max_single_weight": 0.8,
    "equipment_ids": [
      "equip_001"
    ],
    "water_type": "lake",
    "record_template": "lake",
    "tide": null,
    "wave_level": null,
    "boat_name": null,
    "captain_name": null,
    "trip_cost": 0,
    "privacy_level": "private",
    "created_at": "2026-06-08T10:30:00+08:00",
    "updated_at": "2026-06-08T10:30:00+08:00"
  },
  {
    "id": "seed_002",
    "user_id": "demo_user",
    "start_time": "2026-06-05T05:20:00+08:00",
    "end_time": "2026-06-05T09:00:00+08:00",
    "duration_seconds": 13200,
    "fishing_spot_name": "青山江滩",
    "location_name": "青山江滩·天兴洲大桥下",
    "latitude": 30.6278,
    "longitude": 114.4154,
    "weather": "晴",
    "temperature": 25,
    "fish_count": 2,
    "fish_weight": 3.2,
    "fish_species": "鳜鱼",
    "fishing_method": "路亚",
    "bait": "软虫",
    "note": "早窗口用软虫搜结构区，两条鳜鱼都在石头缝附近咬的。路亚越来越顺手了。第一条脱钩了可惜，第二条稳稳上岸约2斤。",
    "images": [],
    "is_blank_trip": false,
    "blank_reason": null,
    "max_single_weight": 2.0,
    "equipment_ids": [],
    "water_type": "river",
    "record_template": "lake",
    "tide": null,
    "wave_level": null,
    "boat_name": null,
    "captain_name": null,
    "trip_cost": 0,
    "privacy_level": "private",
    "created_at": "2026-06-05T09:00:00+08:00",
    "updated_at": "2026-06-05T09:00:00+08:00"
  },
  {
    "id": "seed_003",
    "user_id": "demo_user",
    "start_time": "2026-06-02T05:00:00+08:00",
    "end_time": "2026-06-02T08:00:00+08:00",
    "duration_seconds": 10800,
    "fishing_spot_name": "东湖听涛景区",
    "location_name": "东湖听涛景区·北码头",
    "latitude": 30.558,
    "longitude": 114.368,
    "weather": "晴",
    "temperature": 24,
    "fish_count": 5,
    "fish_weight": 2.1,
    "fish_species": "鳊鱼",
    "fishing_method": "台钓",
    "bait": "商品饵(腥香)",
    "note": "北码头水位下降，改到深水区钓。鳊鱼连口，但个头偏小，最大的也就半斤左右。下次试试玉米粒看能不能上大货。",
    "images": [],
    "is_blank_trip": false,
    "blank_reason": null,
    "max_single_weight": 0.6,
    "equipment_ids": [
      "equip_001"
    ],
    "water_type": "lake",
    "record_template": "lake",
    "tide": null,
    "wave_level": null,
    "boat_name": null,
    "captain_name": null,
    "trip_cost": 0,
    "privacy_level": "private",
    "created_at": "2026-06-02T08:00:00+08:00",
    "updated_at": "2026-06-02T08:00:00+08:00"
  },
  {
    "id": "seed_004",
    "user_id": "demo_user",
    "start_time": "2026-05-31T07:00:00+08:00",
    "end_time": "2026-05-31T12:30:00+08:00",
    "duration_seconds": 19800,
    "fishing_spot_name": "汤逊湖",
    "location_name": "汤逊湖·南岸浅滩",
    "latitude": 30.4119,
    "longitude": 114.3659,
    "weather": "多云",
    "temperature": 27,
    "fish_count": 4,
    "fish_weight": 11.0,
    "fish_species": "鲢鱼",
    "fishing_method": "台钓",
    "bait": "酸饵",
    "note": "汤逊湖的鲢鱼真大！四条加起来破十斤了，最大一条接近4斤。酸饵雾化要控制好，不然闹小鱼。中午气温上来后口明显变少。",
    "images": [],
    "is_blank_trip": false,
    "blank_reason": null,
    "max_single_weight": 3.8,
    "equipment_ids": [
      "equip_001"
    ],
    "water_type": "lake",
    "record_template": "lake",
    "tide": null,
    "wave_level": null,
    "boat_name": null,
    "captain_name": null,
    "trip_cost": 0,
    "privacy_level": "private",
    "created_at": "2026-05-31T12:30:00+08:00",
    "updated_at": "2026-05-31T12:30:00+08:00"
  },
  {
    "id": "seed_005",
    "user_id": "demo_user",
    "start_time": "2026-05-25T06:30:00+08:00",
    "end_time": "2026-05-25T11:30:00+08:00",
    "duration_seconds": 18000,
    "fishing_spot_name": "青山江滩",
    "location_name": "青山江滩·二七桥下缓流区",
    "latitude": 30.626,
    "longitude": 114.414,
    "weather": "多云",
    "temperature": 26,
    "fish_count": 3,
    "fish_weight": 8.2,
    "fish_species": "鲤鱼",
    "fishing_method": "野钓",
    "bait": "玉米+商品饵",
    "note": "江水略浑，但大鲤鱼给力。其中一条接近5斤，遛鱼遛了十分钟才上来，手感绝了！建议用粗线组，今天切线一次。",
    "images": [],
    "is_blank_trip": false,
    "blank_reason": null,
    "max_single_weight": 4.8,
    "equipment_ids": [],
    "water_type": "river",
    "record_template": "lake",
    "tide": null,
    "wave_level": null,
    "boat_name": null,
    "captain_name": null,
    "trip_cost": 0,
    "privacy_level": "private",
    "created_at": "2026-05-25T11:30:00+08:00",
    "updated_at": "2026-05-25T11:30:00+08:00"
  },
  {
    "id": "seed_006",
    "user_id": "demo_user",
    "start_time": "2026-05-18T05:40:00+08:00",
    "end_time": "2026-05-18T09:40:00+08:00",
    "duration_seconds": 14400,
    "fishing_spot_name": "东湖听涛景区",
    "location_name": "东湖听涛景区·南岸",
    "latitude": 30.5567,
    "longitude": 114.3691,
    "weather": "晴",
    "temperature": 23,
    "fish_count": 8,
    "fish_weight": 3.6,
    "fish_species": "鲫鱼",
    "fishing_method": "台钓",
    "bait": "酒米+蚯蚓",
    "note": "五月东湖水温正好，鲫鱼抢食猛。八尾里有一半在半斤以上，最大的一尾将近一斤。钓位选在水草边是关键。",
    "images": [],
    "is_blank_trip": false,
    "blank_reason": null,
    "max_single_weight": 0.9,
    "equipment_ids": [
      "equip_001"
    ],
    "water_type": "lake",
    "record_template": "lake",
    "tide": null,
    "wave_level": null,
    "boat_name": null,
    "captain_name": null,
    "trip_cost": 0,
    "privacy_level": "private",
    "created_at": "2026-05-18T09:40:00+08:00",
    "updated_at": "2026-05-18T09:40:00+08:00"
  },
  {
    "id": "seed_007",
    "user_id": "demo_user",
    "start_time": "2026-05-10T14:00:00+08:00",
    "end_time": "2026-05-10T17:30:00+08:00",
    "duration_seconds": 12600,
    "fishing_spot_name": "南湖",
    "location_name": "南湖·西岸",
    "latitude": 30.4885,
    "longitude": 114.3316,
    "weather": "多云",
    "temperature": 28,
    "fish_count": 2,
    "fish_weight": 7.5,
    "fish_species": "草鱼",
    "fishing_method": "路亚",
    "bait": "米诺",
    "note": "下午窗口期试了路亚，草鱼追饵很猛。第一条脱钩了可惜，第二条稳稳上岸接近5斤。南湖水质比去年好了不少，水草也多了。",
    "images": [],
    "is_blank_trip": false,
    "blank_reason": null,
    "max_single_weight": 4.9,
    "equipment_ids": [],
    "water_type": "lake",
    "record_template": "lake",
    "tide": null,
    "wave_level": null,
    "boat_name": null,
    "captain_name": null,
    "trip_cost": 0,
    "privacy_level": "private",
    "created_at": "2026-05-10T17:30:00+08:00",
    "updated_at": "2026-05-10T17:30:00+08:00"
  },
  {
    "id": "seed_008",
    "user_id": "demo_user",
    "start_time": "2026-04-28T06:00:00+08:00",
    "end_time": "2026-04-28T12:00:00+08:00",
    "duration_seconds": 21600,
    "fishing_spot_name": "府河",
    "location_name": "府河·盘龙城段",
    "latitude": 30.712,
    "longitude": 114.268,
    "weather": "阴",
    "temperature": 20,
    "fish_count": 12,
    "fish_weight": 5.8,
    "fish_species": "鲫鱼",
    "fishing_method": "野钓",
    "bait": "酒米+红虫",
    "note": "春天的府河真好钓，鲫鱼抢食凶猛。十二尾里有一半都在半斤以上，红虫效果明显好于蚯蚓。阴天气压低但鱼口反而好，可能和春末水温有关。",
    "images": [],
    "is_blank_trip": false,
    "blank_reason": null,
    "max_single_weight": 0.8,
    "equipment_ids": [],
    "water_type": "river",
    "record_template": "lake",
    "tide": null,
    "wave_level": null,
    "boat_name": null,
    "captain_name": null,
    "trip_cost": 0,
    "privacy_level": "private",
    "created_at": "2026-04-28T12:00:00+08:00",
    "updated_at": "2026-04-28T12:00:00+08:00"
  },
  {
    "id": "seed_009",
    "user_id": "demo_user",
    "start_time": "2026-04-20T15:30:00+08:00",
    "end_time": "2026-04-20T19:30:00+08:00",
    "duration_seconds": 14400,
    "fishing_spot_name": "南湖",
    "location_name": "南湖·东岸",
    "latitude": 30.489,
    "longitude": 114.333,
    "weather": "阴",
    "temperature": 22,
    "fish_count": 2,
    "fish_weight": 4.6,
    "fish_species": "鲤鱼",
    "fishing_method": "野钓",
    "bait": "红薯+玉米",
    "note": "傍晚时分鲤鱼开始靠边，红薯饵效果不错。两条都在2斤多，手感很好。南湖傍晚景色也美，钓鱼的同时放松心情。",
    "images": [],
    "is_blank_trip": false,
    "blank_reason": null,
    "max_single_weight": 2.6,
    "equipment_ids": [],
    "water_type": "lake",
    "record_template": "lake",
    "tide": null,
    "wave_level": null,
    "boat_name": null,
    "captain_name": null,
    "trip_cost": 0,
    "privacy_level": "private",
    "created_at": "2026-04-20T19:30:00+08:00",
    "updated_at": "2026-04-20T19:30:00+08:00"
  },
  {
    "id": "seed_010",
    "user_id": "demo_user",
    "start_time": "2026-04-12T06:15:00+08:00",
    "end_time": "2026-04-12T10:45:00+08:00",
    "duration_seconds": 16200,
    "fishing_spot_name": "东湖听涛景区",
    "location_name": "东湖听涛景区·南岸",
    "latitude": 30.5567,
    "longitude": 114.3691,
    "weather": "晴",
    "temperature": 18,
    "fish_count": 6,
    "fish_weight": 2.8,
    "fish_species": "鲫鱼",
    "fishing_method": "台钓",
    "bait": "酒米+麦粒",
    "note": "四月的东湖水温还偏低，鱼口比较轻。调灵漂后明显好转，麦粒的效果比蚯蚓好，可能是因为小鱼少不闹窝。",
    "images": [],
    "is_blank_trip": false,
    "blank_reason": null,
    "max_single_weight": 0.7,
    "equipment_ids": [
      "equip_001"
    ],
    "water_type": "lake",
    "record_template": "lake",
    "tide": null,
    "wave_level": null,
    "boat_name": null,
    "captain_name": null,
    "trip_cost": 0,
    "privacy_level": "private",
    "created_at": "2026-04-12T10:45:00+08:00",
    "updated_at": "2026-04-12T10:45:00+08:00"
  },
  {
    "id": "seed_011",
    "user_id": "demo_user",
    "start_time": "2026-06-10T06:00:00+08:00",
    "end_time": "2026-06-10T10:00:00+08:00",
    "duration_seconds": 14400,
    "fishing_spot_name": "汉口江滩",
    "location_name": "汉口江滩·缓流湾",
    "latitude": 30.5942,
    "longitude": 114.3084,
    "weather": "阴",
    "temperature": 24,
    "fish_count": 0,